{"schema_version":1,"id":"vscode","name":"Visual Studio Code","category":"GUI Applications","platforms":["windows"],"package":{"id":"Microsoft.VisualStudioCode","scope":"user","detect":["code.exe"],"verify":["code","--version"]},"config":{"source":"chezmoi/AppData/Roaming/Code/User","destinations":["AppData/Roaming/Code/User/settings.json","AppData/Roaming/Code/User/keybindings.json","AppData/Roaming/Code/User/snippets/mysetup.code-snippets"],"targets":["AppData/Roaming/Code/User/settings.json","AppData/Roaming/Code/User/keybindings.json","AppData/Roaming/Code/User/snippets/mysetup.code-snippets"],"exclusions":["globalStorage","workspaceStorage","History","sync","*.db"]},"minimum_engine_version":"0.1.0"}
