{"schema_version":1,"id":"micro","name":"Micro","category":"CLI Tools","platforms":["windows"],"package":{"id":"zyedidia.micro","scope":"user","detect":["micro.exe"],"verify":["micro","--version"]},"config":{"source":"chezmoi/AppData/Roaming/micro","destinations":["AppData/Roaming/micro/settings.json","AppData/Roaming/micro/bindings.json"],"targets":["AppData/Roaming/micro/settings.json","AppData/Roaming/micro/bindings.json"],"exclusions":["buffers","history"]},"minimum_engine_version":"0.1.0"}
