{"schema_version":1,"id":"terminal","name":"Windows Terminal","category":"GUI Applications","platforms":["windows"],"package":{"id":"Microsoft.WindowsTerminal","scope":"user","detect":["wt.exe"],"verify":["wt","--version"]},"config":{"source":"chezmoi/AppData/Local/Packages/Microsoft.WindowsTerminal_8wekyb3d8bbwe/LocalState","destinations":["AppData/Local/Packages/Microsoft.WindowsTerminal_8wekyb3d8bbwe/LocalState/settings.json"],"targets":["AppData/Local/Packages/Microsoft.WindowsTerminal_8wekyb3d8bbwe/LocalState/settings.json"],"exclusions":["defaults.json","state.json"]},"minimum_engine_version":"0.1.0"}
