{"schema_version":1,"id":"git","name":"Git","category":"CLI Tools","platforms":["windows"],"package":{"id":"Git.Git","scope":"user","detect":["git.exe"],"verify":["git","--version"]},"config":{"source":"chezmoi","destinations":[".gitconfig"],"targets":[".gitconfig"],"verify":["git","config","--global","--list"],"exclusions":[".git-credentials","credential.helper"]},"minimum_engine_version":"0.1.0"}
