{"schema_version":1,"id":"powershell","name":"PowerShell 7","category":"CLI Tools","platforms":["windows"],"package":{"id":"Microsoft.PowerShell","scope":"user","detect":["pwsh.exe"],"verify":["pwsh","-NoProfile","-Command","$PSVersionTable.PSVersion.Major -ge 7"]},"config":{"source":"chezmoi/Documents/PowerShell","destinations":["Documents/PowerShell/Microsoft.PowerShell_profile.ps1"],"targets":["Documents/PowerShell/Microsoft.PowerShell_profile.ps1"],"verify":["pwsh","-NoProfile","-File","Documents/PowerShell/Microsoft.PowerShell_profile.ps1"],"exclusions":["ConsoleHost_history.txt","*.clixml"]},"recommended":["starship","fzf","zoxide"],"minimum_engine_version":"0.1.0"}
