{"schema_version":1,"id":"gh","name":"GitHub CLI","category":"CLI Tools","platforms":["windows"],"package":{"id":"GitHub.cli","scope":"user","detect":["gh.exe"],"verify":["gh","--version"]},"config":{"source":"chezmoi/AppData/Roaming/GitHub CLI","destinations":["AppData/Roaming/GitHub CLI/config.yml"],"targets":["AppData/Roaming/GitHub CLI/config.yml"],"exclusions":["hosts.yml"]},"minimum_engine_version":"0.1.0"}
