{"schema_version":1,"id":"yazi","name":"Yazi","category":"CLI Tools","platforms":["windows"],"package":{"id":"sxyazi.yazi","scope":"user","detect":["yazi.exe"],"verify":["yazi","--version"]},"config":{"source":"chezmoi/AppData/Roaming/yazi/config","destinations":["AppData/Roaming/yazi/config/yazi.toml","AppData/Roaming/yazi/config/keymap.toml"],"targets":["AppData/Roaming/yazi/config/yazi.toml","AppData/Roaming/yazi/config/keymap.toml"],"exclusions":["plugins/*/target","state"]},"recommended":["fd","fzf","ripgrep","bat","jq"],"minimum_engine_version":"0.1.0"}
